RDF Type	ID	Parent	Label	editor preferred term	Alternate name	Definition	Example	Curation Status	Editors Note	term editor	Reference
TYPE	ID	SC %	AL rdfs:label@en	AL iao:0000111@en	AL iao:0000118@en	AL iao:0000115@en	AL iao:0000112@en	AT iao:0000114^^xsd:anyuri	AL iao:0000116@en	AL iao:0000117@en	AL iao:0000119@en
owl:Class	org:0000001	bfo:0000031	organization	test		A group of people recognized as such by people outside the group.	"a political party, a homeowners association, a football team, a publisher, a government agency, an organized religion"	obo:0000124		Michael Conlon https://orcid.org/0000-0002-1304-8447	
owl:Class	org:0000002	org:0000001	government organization	government	government	An organization which is the body of persons that constitutes the governing authority of a political unit	"The State of Florida is recognized as a government organization by the United States.  The government of the United States is recognized by other governments.  Note there is no ""part of"" relationship here.  Each is a government organization."	obo:0000124		Michael Conlon https://orcid.org/0000-0002-1304-8448	https://www.merriam-webster.com/dictionary/government
owl:Class	org:0000003	org:0000001	company			"A legal entity of associated persons created for a specific purpose, typically commercial, in which excess revenue may be distributed to the company's owners."	"BASF, The University of Phoenix, Facebook, Elsevier, Apple, Google, Amazon"	obo:0000124		Michael Conlon https://orcid.org/0000-0002-1304-8449	See https://www.merriam-webster.com/dictionary/company
owl:Class	org:0000004	org:0000001	non-profit organization		not for profit	"A legal entity of associated persons created for a specific purpose, typically a mission, in which excess revenue is reinvested to serve the entity's mission"	"Doctors Without Borders, Duke University, The American Medical Association"	obo:0000124		Michael Conlon https://orcid.org/0000-0002-1304-8450	
owl:Class	org:0000005	org:0000001	informal organization			A group of people recognized as such by people outside the group. Without legal standing.	"A student club, a university committee, the VIVO Ontology Interest Group"	obo:0000124	"There are many names associated with informal organizations, such as club, group, party, team, cell, task force, work group, interest group, meeting, roundtable, .  So far dispositions and qualities that would distinguish the entities with various names have not been formulated."	Michael Conlon https://orcid.org/0000-0002-1304-8451	
owl:Class	org:0000006	org:0000001	organization part			An organization which exists as part of another organization.  Implies a part_of relationship to another organization	The US Navy is an organizational part of the US Department of Defense.  The History Department is an organizational part of its college.	obo:0000124		Michael Conlon https://orcid.org/0000-0002-1304-8452	