RDF Type	ID	Parent	Label	Domain	Range	editor preferred term	Alternate name	Definition	Example	Editors Note	term editor	Reference
TYPE	ID	SP %	AL rdfs:label@en	DOMAIN	RANGE	AL iao:0000111@en	AL iao:0000118@en	AL iao:0000115@en	AL iao:0000112@en	AL iao:0000116@en	AL iao:0000117@en	AL iao:0000119@en
data property	org:3000001	owl:topDataProperty	number of employees	org:0000001	xsd:nonNegativeInteger		# of employees	The number of people (headcount) who receive paychecks from the organization for work performed	Amazon.com number_of_employees 1300000	Informal organizations do not have employees.  Create a class restriction as a domain.	Michael Conlon https://orcid.org/0000-0002-1304-8447	Michael Conlon https://orcid.org/0000-0002-1304-8447
data property	org:3000002	obi:00002815	has email representation	org:0000001	xsd:string		has email value	Specifies the email address string for an email address	info@metabolomics.info	Regex pattern restriction for RFC ??? Email addresses	Michael Conlon https://orcid.org/0000-0002-1304-8448	Michael Conlon https://orcid.org/0000-0002-1304-8448
data property	org:3000003	obi:00002815	has postal address representation		xsd:string		has address value	Specifies the postal address string for a postal address	1210 NW 14th Ave; ;Gainesville; Fl; USA; 32601	Regex pattern restriction for UPC email addresses	Michael Conlon https://orcid.org/0000-0002-1304-8449	Michael Conlon https://orcid.org/0000-0002-1304-8449
data property	org:3000004	obi:00002815	has geolocation representation		xsd:string		has geolocation	Specifies the geolocation string for a geolocation	"29.6651224,-82.3396949"	Regex pattern restriction to +/-lat;+/-long	Michael Conlon https://orcid.org/0000-0002-1304-8450	Michael Conlon https://orcid.org/0000-0002-1304-8450